{
  "artifact_type": "provenance",
  "canonical": false,
  "data": {
    "artifact_lineage": [
      {
        "artifact_id": "aligned_SYN_L001",
        "operation": "BWA-MEM2",
        "parents": [
          "validated_lane_fastq",
          "reference.fa"
        ]
      },
      {
        "artifact_id": "aligned_SYN_L002",
        "operation": "BWA-MEM2",
        "parents": [
          "validated_lane_fastq",
          "reference.fa"
        ]
      },
      {
        "artifact_id": "sorted_SYN_L001",
        "operation": "coordinate_sort",
        "parents": [
          "aligned_SYN_L001"
        ]
      },
      {
        "artifact_id": "sorted_SYN_L002",
        "operation": "coordinate_sort",
        "parents": [
          "aligned_SYN_L002"
        ]
      },
      {
        "artifact_id": "merged",
        "operation": "lane_merge",
        "parents": [
          "sorted_SYN_L001",
          "sorted_SYN_L002"
        ]
      },
      {
        "artifact_id": "duplicate_marked",
        "operation": "MarkDuplicates_retained",
        "parents": [
          "merged"
        ]
      },
      {
        "artifact_id": "recalibration_table",
        "operation": "BaseRecalibrator",
        "parents": [
          "duplicate_marked",
          "known-sites.vcf"
        ]
      },
      {
        "artifact_id": "analysis_ready",
        "operation": "ApplyBQSR_emit_original_quals",
        "parents": [
          "duplicate_marked",
          "recalibration_table"
        ]
      }
    ],
    "callers_executed": [],
    "canonical_hg001_executed": false,
    "capture_design_gate": "blocked",
    "claim_boundary": "actual execution of deterministic invented preprocessing only; no human-data, caller, benchmark, or deployment claim",
    "fixture_expectations_sha256": "d8f87a4eddd93eebd1cee5c9d77bfa1b8093714a8b3c2edc434742a3f3e16c1d",
    "fixture_recipe_version": "1.0.0",
    "host_python_container": null,
    "known_sites_sha256": "1d186908d513980e73b91dadd1470b780d05a952c7c927c363ee30be58713f9d",
    "reference_sha256": "f026a6bf067f2f1964aa607181d0258d61a07c2ec9cd16c1cddfc2f7c52d1454",
    "repository_sha": "c929718a76b51e48bea6c4b9ebcb451a9d94574c",
    "sample": "SYNTHETIC01",
    "shared_bam_sha256": "175c951275fb02ad6378de941fa12d54d3e8d1acfabbf7aba6604e6b5afacff8",
    "source_preflight_payload_sha256": "7a11116aee7709c9875d685fe7eb708858f3d2bfe4ff32a4af64dbfc059656f5",
    "stage_artifacts": [
      {
        "artifact_id": "analysis_ready",
        "bytes": 5099,
        "filename": "SYNTHETIC01.analysis-ready.bam",
        "role": "preprocessing_transformation",
        "sha256": "175c951275fb02ad6378de941fa12d54d3e8d1acfabbf7aba6604e6b5afacff8"
      },
      {
        "artifact_id": "aligned_SYN_L001",
        "bytes": 1859,
        "filename": "SYN_L001.aligned.bam",
        "role": "preprocessing_transformation",
        "sha256": "d15cbdaafedb3f35a2d58c80faf02bcec23a784f23289d9a56dd2f52b3a5c671"
      },
      {
        "artifact_id": "sorted_SYN_L001",
        "bytes": 1907,
        "filename": "SYN_L001.sorted.bam",
        "role": "preprocessing_transformation",
        "sha256": "687521d2fe915823f4615947671f6765333bbe5b0b2038c194bebb8d5806782d"
      },
      {
        "artifact_id": "aligned_SYN_L002",
        "bytes": 1896,
        "filename": "SYN_L002.aligned.bam",
        "role": "preprocessing_transformation",
        "sha256": "dcd00362c0507312dfe75b8eab2df34df69e50285c959ec4670fbf7a3d4da6cb"
      },
      {
        "artifact_id": "sorted_SYN_L002",
        "bytes": 1948,
        "filename": "SYN_L002.sorted.bam",
        "role": "preprocessing_transformation",
        "sha256": "00ef82c5a39fcd8f76b907e104afa2d54c30cd7e234811aead50b138fdb1f8ef"
      },
      {
        "artifact_id": "merged",
        "bytes": 3356,
        "filename": "SYNTHETIC01.merged.bam",
        "role": "preprocessing_transformation",
        "sha256": "5ad76fd670bb390c1a536342dea87d4e5d9c2788cde95abe1f42a500569b5781"
      },
      {
        "artifact_id": "duplicate_marked",
        "bytes": 4263,
        "filename": "SYNTHETIC01.markdup.bam",
        "role": "preprocessing_transformation",
        "sha256": "f6b8a01e62e271766e6ed4ac4985b9eabe7b0eb9812f2a0ac662c884a5e03fb1"
      },
      {
        "artifact_id": "recalibration_table",
        "bytes": 704192,
        "filename": "SYNTHETIC01.recal.table",
        "role": "preprocessing_transformation",
        "sha256": "36c5e868152b4edd1e280c656d4e2d08a7e26eb97b7c076f5073849e91c8afda"
      }
    ],
    "tools": [
      {
        "container_identity_status": "workflow_declared_digest",
        "container_image": "quay.io/biocontainers/bwa-mem2@sha256:374f4b910b4b04d32772fccd4cab1cdcd0758356856a960cfa8b1edebfd38c9f",
        "declared_version": "2.3",
        "expected_reported_version": "2.2.1",
        "name": "bwa-mem2",
        "observed_version_text": "Looking to launch executable \"/usr/local/bin/bwa-mem2.avx2\", simd = .avx2\nLaunching executable \"/usr/local/bin/bwa-mem2.avx2\"\n2.2.1",
        "version_evidence": {
          "artifact_id": "bwa-mem2_version",
          "bytes": 132,
          "filename": "bwa_index.versions.txt",
          "role": "tool_version_stdout",
          "sha256": "0e5b7b8cd8c5c15f1a1f881840b596bd0ec47a0aa29485036fd0e23780fb094f"
        },
        "version_evidence_sources": [
          {
            "detail": "Release archive member bwa-mem2-2.3/src/main.cpp defines fallback PACKAGE_VERSION as 2.2.1 and the version command prints it.",
            "kind": "upstream_release_source",
            "sha256": "0c48a1ea800af499ae7264b4c8908c4ca35fbe5a7df2ad6106c79aa94bb49cbb",
            "url": "https://github.com/bwa-mem2/bwa-mem2/releases/download/v2.3/Source_code_including_submodules.tar.gz"
          },
          {
            "detail": "CI job 101678215450 at tested merge 40078d3d5f2687a3715e00eb26706c2687b296e0 selected the avx2 executable and printed 2.2.1. The run failed its previous version gate and supplies no completed M3 acceptance claim.",
            "kind": "historical_ci_artifact",
            "sha256": "42f4a0a40136e9a64305afc5d49fa973090d6f33da503e900bfea88d05ea4de1",
            "url": "https://github.com/jcollins-bioinfo/giab-wes-nextflow/actions/runs/34101964128/artifacts/10010921650"
          }
        ],
        "version_note": "Distribution release 2.3 at this immutable image digest reports 2.2.1 from its avx2 executable. The official v2.3 source archive retains PACKAGE_VERSION 2.2.1, consistent with the observed report. This stale self-report does not establish that the executed code is release 2.2.1 or prove complete source-to-binary correspondence. Require exactly 2.2.1 for this pin; retain each run stdout independently."
      },
      {
        "container_identity_status": "workflow_declared_digest",
        "container_image": "quay.io/biocontainers/fastqc@sha256:e194048df39c3145d9b4e0a14f4da20b59d59250465b6f2a9cb698445fd45900",
        "declared_version": "0.12.1",
        "expected_reported_version": "0.12.1",
        "name": "fastqc",
        "observed_version_text": "FastQC v0.12.1",
        "version_evidence": {
          "artifact_id": "fastqc_version",
          "bytes": 15,
          "filename": "SYN_L001.fastqc.versions.txt",
          "role": "tool_version_stdout",
          "sha256": "e8cd237d3ff818e7320597cfb3052a9771269c76148ab99dffce75ed550ccec9"
        },
        "version_evidence_sources": [],
        "version_note": "The expected executable version report equals the distribution release; each run must retain its own observed stdout."
      },
      {
        "container_identity_status": "workflow_declared_digest",
        "container_image": "registry-1.docker.io/broadinstitute/gatk@sha256:7da5cf586e1c463f0c72908f9ac7dec8c29e37912c82d6e7b3c250f27fcb3891",
        "declared_version": "4.7.0.0",
        "expected_reported_version": "4.7.0.0",
        "name": "gatk",
        "observed_version_text": "Using GATK jar /gatk/gatk-package-4.7.0.0-local.jar\nRunning:\n    java -Dsamjdk.use_async_io_read_samtools=false -Dsamjdk.use_async_io_write_samtools=true -Dsamjdk.use_async_io_write_tribble=false -Dsamjdk.compression_level=2 -jar /gatk/gatk-package-4.7.0.0-local.jar --version\nThe Genome Analysis Toolkit (GATK) v4.7.0.0\nHTSJDK Version: 5.0.0\nPicard Version: 3.5.0",
        "version_evidence": {
          "artifact_id": "gatk_version",
          "bytes": 365,
          "filename": "SYNTHETIC01.apply_bqsr.versions.txt",
          "role": "tool_version_stdout",
          "sha256": "6785c98bbed388343f927d69930557d9d531eacb5435c37cd3ed872952f711c8"
        },
        "version_evidence_sources": [],
        "version_note": "The expected executable version report equals the distribution release; each run must retain its own observed stdout."
      },
      {
        "container_identity_status": "workflow_declared_digest",
        "container_image": "quay.io/biocontainers/mosdepth@sha256:63f50e21185f5ce50fb0b6c6d3b3d4b7e50ab19356096f1045ca2538b739793c",
        "declared_version": "0.3.14",
        "expected_reported_version": "0.3.14",
        "name": "mosdepth",
        "observed_version_text": "mosdepth 0.3.14",
        "version_evidence": {
          "artifact_id": "mosdepth_version",
          "bytes": 16,
          "filename": "SYNTHETIC01.mosdepth.versions.txt",
          "role": "tool_version_stdout",
          "sha256": "e42debab8d2bc9cd3a8a9bf216f0d765e03f874bf918e9c9910258545810e0f3"
        },
        "version_evidence_sources": [],
        "version_note": "The expected executable version report equals the distribution release; each run must retain its own observed stdout."
      },
      {
        "container_identity_status": "workflow_declared_digest",
        "container_image": "ghcr.io/multiqc/multiqc@sha256:976be2094a3bc1dab7315ad03440d43aab09bf7756f84f3a92ef7ae1013e4bfd",
        "declared_version": "1.35",
        "expected_reported_version": "1.35",